{
 "snapshot_date": "2026-10-19",
 "quarantine": null,
 "registers": [
  {
   "slug": "other-wp",
   "title": "White papers — other crypto-assets (Title II)",
   "entries": 1049,
   "entities": 657,
   "fetched": true,
   "source_last_modified": "Fri, 16 Oct 2026 15:37:13 GMT",
   "fetched_from": "",
   "archived_at": ""
  },
  {
   "slug": "emt-wp",
   "title": "White papers — e-money tokens (Title IV)",
   "entries": 50,
   "entities": 25,
   "fetched": true,
   "source_last_modified": "Fri, 16 Oct 2026 15:36:34 GMT",
   "fetched_from": "",
   "archived_at": ""
  },
  {
   "slug": "art-wp",
   "title": "White papers — asset-referenced tokens (Title III)",
   "entries": 0,
   "entities": 0,
   "fetched": true,
   "source_last_modified": "Fri, 14 Feb 2025 15:37:53 GMT",
   "fetched_from": "",
   "archived_at": ""
  },
  {
   "slug": "casps",
   "title": "Authorised crypto-asset service providers (CASPs)",
   "entries": 378,
   "entities": 375,
   "fetched": true,
   "source_last_modified": "Fri, 16 Oct 2026 15:36:15 GMT",
   "fetched_from": "",
   "archived_at": ""
  },
  {
   "slug": "ncasp",
   "title": "Non-compliant entities flagged by NCAs",
   "entries": 178,
   "entities": 175,
   "fetched": true,
   "source_last_modified": "Fri, 16 Oct 2026 15:36:52 GMT",
   "fetched_from": "",
   "archived_at": ""
  }
 ],
 "recent_changes": [
  {
   "snapshot_date": "2026-10-19",
   "register_slug": "casps",
   "change": "changed",
   "entry_id": "c43f74e9c3983154",
   "entity_name": "FINTECH PAYMENTS PSC S.L.",
   "member_state": "ES",
   "wp_url": "",
   "detail": "register row content changed",
   "record_version": 2,
   "lei": "549300746K71T6YJCV41",
   "row_key": "73aa4aff36424e2a",
   "row_hash": "1e7feac54de1377b",
   "subtypes": [],
   "changed_fields": []
  },
  {
   "snapshot_date": "2026-10-19",
   "register_slug": "casps",
   "change": "added",
   "entry_id": "6a7c809348f47711",
   "entity_name": "PRAKMA MARKETS S.L.",
   "member_state": "ES",
   "wp_url": "",
   "detail": "",
   "record_version": 2,
   "lei": "959800BLRZ4Z36U5HK79",
   "row_key": "118351083eef3c52",
   "row_hash": "07fc3c7e2838676a",
   "subtypes": [],
   "changed_fields": []
  },
  {
   "snapshot_date": "2026-10-19",
   "register_slug": "casps",
   "change": "changed",
   "entry_id": "3678b06d071f7230",
   "entity_name": "Coinmotion Oy",
   "member_state": "FI",
   "wp_url": "",
   "detail": "register row content changed",
   "record_version": 2,
   "lei": "743700PZG5RRF7SA4Q58",
   "row_key": "f43ad3b532ec41a0",
   "row_hash": "7611311e29f3beda",
   "subtypes": [],
   "changed_fields": []
  },
  {
   "snapshot_date": "2026-10-19",
   "register_slug": "casps",
   "change": "changed",
   "entry_id": "0c5a6063b848dd7c",
   "entity_name": "Tesseract Investment Oy",
   "member_state": "FI",
   "wp_url": "",
   "detail": "register row content changed",
   "record_version": 2,
   "lei": "743700GULNWPBLJ7A022",
   "row_key": "0d4c3555baebd698",
   "row_hash": "fd4d9daf1207d168",
   "subtypes": [],
   "changed_fields": []
  },
  {
   "snapshot_date": "2026-10-19",
   "register_slug": "casps",
   "change": "changed",
   "entry_id": "a874e5b86d8b6f3f",
   "entity_name": "Bittimaatti Oy",
   "member_state": "FI",
   "wp_url": "",
   "detail": "register row content changed",
   "record_version": 2,
   "lei": "7437009FHK501IOCWZ66",
   "row_key": "e1179936e2c96660",
   "row_hash": "74bcbe5917f4b990",
   "subtypes": [],
   "changed_fields": []
  },
  {
   "snapshot_date": "2026-10-19",
   "register_slug": "casps",
   "change": "changed",
   "entry_id": "bdf381ed273b8143",
   "entity_name": "NorthCrypto Oy",
   "member_state": "FI",
   "wp_url": "",
   "detail": "register row content changed",
   "record_version": 2,
   "lei": "743700CHRVVP342JOA67",
   "row_key": "28bfa101f25c06ee",
   "row_hash": "9fde90202fe98f9f",
   "subtypes": [],
   "changed_fields": []
  },
  {
   "snapshot_date": "2026-10-19",
   "register_slug": "casps",
   "change": "changed",
   "entry_id": "8f8ae8dc42590de6",
   "entity_name": "Kvarn Capital Oy",
   "member_state": "FI",
   "wp_url": "",
   "detail": "register row content changed",
   "record_version": 2,
   "lei": "9845009F15A5B9FD7F45",
   "row_key": "c45069ee2b738fdf",
   "row_hash": "e0b76354cca2c8a4",
   "subtypes": [],
   "changed_fields": []
  },
  {
   "snapshot_date": "2026-10-19",
   "register_slug": "casps",
   "change": "changed",
   "entry_id": "7fa0a8c158e8c6ad",
   "entity_name": "DEBLOCK SAS",
   "member_state": "FR",
   "wp_url": "",
   "detail": "register row content changed",
   "record_version": 2,
   "lei": "254900XTUI35BGIBXP21",
   "row_key": "8c7842d2f2c27d11",
   "row_hash": "6601f8d617adb620",
   "subtypes": [],
   "changed_fields": []
  },
  {
   "snapshot_date": "2026-10-19",
   "register_slug": "casps",
   "change": "changed",
   "entry_id": "bc63550344146be1",
   "entity_name": "GOin SAS",
   "member_state": "FR",
   "wp_url": "",
   "detail": "register row content changed",
   "record_version": 2,
   "lei": "894500LM6DICD790FQ34",
   "row_key": "413696ff53526c69",
   "row_hash": "5096639f02648d18",
   "subtypes": [],
   "changed_fields": []
  },
  {
   "snapshot_date": "2026-10-19",
   "register_slug": "casps",
   "change": "changed",
   "entry_id": "de1307aaca95ccf9",
   "entity_name": "CACEIS BANK",
   "member_state": "FR",
   "wp_url": "",
   "detail": "register row content changed",
   "record_version": 2,
   "lei": "96950023SCR9X9F3L662",
   "row_key": "69706e19ff4335cb",
   "row_hash": "57fb329db83b0f52",
   "subtypes": [],
   "changed_fields": []
  },
  {
   "snapshot_date": "2026-10-19",
   "register_slug": "casps",
   "change": "changed",
   "entry_id": "4b2263c5d1318679",
   "entity_name": "BITSTACK DIGITAL ASSETS SAS",
   "member_state": "FR",
   "wp_url": "",
   "detail": "register row content changed",
   "record_version": 2,
   "lei": "894500RKZ3TVTPIF7V84",
   "row_key": "e56d0a1626ca9030",
   "row_hash": "8d255fc802ce972f",
   "subtypes": [],
   "changed_fields": []
  },
  {
   "snapshot_date": "2026-10-19",
   "register_slug": "casps",
   "change": "changed",
   "entry_id": "1e5047b9d10bd82d",
   "entity_name": "METAL GEAR SAS",
   "member_state": "FR",
   "wp_url": "",
   "detail": "register row content changed",
   "record_version": 2,
   "lei": "969500PQYLQG3CSJ5041",
   "row_key": "ddc7b22425329968",
   "row_hash": "d1419033f26c07fe",
   "subtypes": [],
   "changed_fields": []
  },
  {
   "snapshot_date": "2026-10-19",
   "register_slug": "casps",
   "change": "changed",
   "entry_id": "8d68d5679aa2bb13",
   "entity_name": "COINSHARES ASSET MANAGEMENT",
   "member_state": "FR",
   "wp_url": "",
   "detail": "register row content changed",
   "record_version": 2,
   "lei": "969500DBF3ZL9U0KUA51",
   "row_key": "d41331b312c0dd9a",
   "row_hash": "52a634c548cf0206",
   "subtypes": [],
   "changed_fields": []
  },
  {
   "snapshot_date": "2026-10-19",
   "register_slug": "casps",
   "change": "changed",
   "entry_id": "e337105e45a23268",
   "entity_name": "FINCTEK UE SAS",
   "member_state": "FR",
   "wp_url": "",
   "detail": "register row content changed",
   "record_version": 2,
   "lei": "969500PTJJZTCE0I3B60",
   "row_key": "f94e00e79ae0f3cf",
   "row_hash": "c1f6a3ff19c25a16",
   "subtypes": [],
   "changed_fields": []
  },
  {
   "snapshot_date": "2026-10-19",
   "register_slug": "casps",
   "change": "changed",
   "entry_id": "b3d15ed546b8034a",
   "entity_name": "RELAI EU SASU",
   "member_state": "FR",
   "wp_url": "",
   "detail": "register row content changed",
   "record_version": 2,
   "lei": "9695003EKRFOMYXJQL11",
   "row_key": "5ccc316b437122ae",
   "row_hash": "8b7a0a7471d88bcc",
   "subtypes": [],
   "changed_fields": []
  },
  {
   "snapshot_date": "2026-10-19",
   "register_slug": "casps",
   "change": "changed",
   "entry_id": "3dcf755a0c3784fb",
   "entity_name": "SOCIETE GENERALE - FORGE",
   "member_state": "FR",
   "wp_url": "",
   "detail": "register row content changed",
   "record_version": 2,
   "lei": "969500FX8K40ZDW4F377",
   "row_key": "c86d7ebe44702de9",
   "row_hash": "8e4a927a7b08aa93",
   "subtypes": [],
   "changed_fields": []
  },
  {
   "snapshot_date": "2026-10-19",
   "register_slug": "casps",
   "change": "changed",
   "entry_id": "c6ee665cdfc39fdb",
   "entity_name": "BANQUE DELUBAC ET CIE",
   "member_state": "FR",
   "wp_url": "",
   "detail": "register row content changed",
   "record_version": 2,
   "lei": "969500A4IPKVUBH3CA90",
   "row_key": "b77e06ed8a519f3d",
   "row_hash": "2be01af01961fbd7",
   "subtypes": [],
   "changed_fields": []
  },
  {
   "snapshot_date": "2026-10-19",
   "register_slug": "casps",
   "change": "changed",
   "entry_id": "bd7350fabced512b",
   "entity_name": "COMETH SAS",
   "member_state": "FR",
   "wp_url": "",
   "detail": "register row content changed",
   "record_version": 2,
   "lei": "894500R5KSX3ZKIHSA46",
   "row_key": "8b9991f6f37441a7",
   "row_hash": "40ebf529f578843f",
   "subtypes": [],
   "changed_fields": []
  },
  {
   "snapshot_date": "2026-10-19",
   "register_slug": "casps",
   "change": "changed",
   "entry_id": "80accb93d105863d",
   "entity_name": "FIPTO PI SAS",
   "member_state": "FR",
   "wp_url": "",
   "detail": "register row content changed",
   "record_version": 2,
   "lei": "969500A0DYUNF5NX9R84",
   "row_key": "bafe75fc21d29ba9",
   "row_hash": "5ba0dd0c1a9b684b",
   "subtypes": [],
   "changed_fields": []
  },
  {
   "snapshot_date": "2026-10-19",
   "register_slug": "casps",
   "change": "changed",
   "entry_id": "ccd7aa9f3f4587d2",
   "entity_name": "HEXARQ SAS",
   "member_state": "FR",
   "wp_url": "",
   "detail": "register row content changed",
   "record_version": 2,
   "lei": "969500TD4VXAOPXPVW02",
   "row_key": "26e3840b8a4f3cf2",
   "row_hash": "f737d3677e9c8cd8",
   "subtypes": [],
   "changed_fields": []
  },
  {
   "snapshot_date": "2026-10-19",
   "register_slug": "casps",
   "change": "changed",
   "entry_id": "3c3aa3111728d639",